uri,text
http://data.doremus.org/ontology#M157_Statement_of_Responsibility,M157 Statement of responsibility 
http://data.doremus.org/ontology#U179_has_parallel_statement_of_responsibility_relating_to_edition,U179 has parallel statement of responsibility relating to edition 
http://data.doremus.org/ontology#U173_has_parallel_statement_of_responsibility_relating_to_title,U173 has parallel statement of responsibility relating to title 
http://erlangen-crm.org/efrbroo/F22_Self-Contained_Expression,F22 Self- Contained Expression 
http://data.doremus.org/ontology#U172_has_statement_of_responsibility_relating_to_title,U172 has statement of responsibility relating to title 
http://erlangen-crm.org/efrbroo/F24_Publication_Expression,F24 Publication Expression 
