uri,text
https://w3id.org/arco/ontology/arco/numberOfArchaeologicalMaterials,number of archeological materials 
https://w3id.org/arco/ontology/arco/hasArchaeologicalMaterialCategory,has archaeological material category 
https://w3id.org/arco/ontology/arco/ArchaeologicalMaterial,Archaeological material 
https://w3id.org/arco/ontology/arco/ArchaeologicalMaterialCategory,Archaeological material category 
https://w3id.org/arco/ontology/arco/isArchaeologicalMaterialCategoryOf,is archaeological material category of 
