uri,text
https://www.ica.org/standards/RiC/ontology#derivationRelationHasTarget,derivation relation has target  
https://www.ica.org/standards/RiC/ontology#derivationRelationHasSource,derivation relation has source  
https://www.ica.org/standards/RiC/ontology#Instantiation,Instantiation 
https://www.ica.org/standards/RiC/ontology#instantiationIsTargetOfDerivationRelation,instantiation is target of derivation relation  
https://www.ica.org/standards/RiC/ontology#instantiationIsSourceOfDerivationRelation,instantiation is source of derivation relation  
https://www.ica.org/standards/RiC/ontology#DerivationRelation,Derivation Relation 
