uri,text
https://www.ica.org/standards/RiC/ontology#isOrWasLanguageOfAllMembersOf,is or was language of all members of 
https://www.ica.org/standards/RiC/ontology#hasOrHadAllMembersWithLanguage,has of had all members with language 
https://www.ica.org/standards/RiC/ontology#isOrWasLanguageOfSomeMembersOf,is or was language of some members of 
https://www.ica.org/standards/RiC/ontology#hasOrHadSomeMembersWithLanguage,has or had some members with language 
https://www.ica.org/standards/RiC/ontology#RecordSet,Record Set 
https://www.ica.org/standards/RiC/ontology#Language,Language 
