uri,text
https://www.ica.org/standards/RiC/ontology#isOrWasCategoryOfSomeMembersOf,is or was category of some members of 
https://www.ica.org/standards/RiC/ontology#Type,Type 
https://www.ica.org/standards/RiC/ontology#Thing,Thing 
https://www.ica.org/standards/RiC/ontology#hasOrHadSomeMembersWithCategory,has or had some members with category 
https://www.ica.org/standards/RiC/ontology#isOrWasCategoryOf,is or was category of 
https://www.ica.org/standards/RiC/ontology#hasOrHadAllMembersWithCategory,has or had all members with category 
https://www.ica.org/standards/RiC/ontology#RecordSet,Record Set 
https://www.ica.org/standards/RiC/ontology#isOrWasCategoryOfAllMembersOf,is or was category of all members of 
https://www.ica.org/standards/RiC/ontology#hasOrHadCategory,has or had category 
